1,Impedit quia hic est.,Eos eius eos enim iusto facilis sint. Totam dignissimos qui porro repellat excepturi. Assumenda est illo eum eos voluptatibus dolores eligendi. Sit iusto qui sunt.,1/31/2019 6:36,1/31/2019 6:36
2,"Quam, voluptas veritatis distinctio quo minima.",Voluptatum sed aut cum ipsam dolor in. Sit adipisci nemo maxime eum dolor. Voluptatem dolor sint vero pariatur sunt.,1/31/2019 6:36,1/31/2019 6:36
3,Nam dolor similique et sint omnis qui.,Dolor nobis ea provident commodi veritatis. Soluta facilis iure sed dolorum et atque. Ut quia ea culpa ratione voluptas.,1/31/2019 6:36,1/31/2019 6:36
4,Voluptatem et sed id temporibus inventore.,Modi eum quidem non quod laudantium et. Aliquid non quam provident unde ut. Voluptatem aut aut commodi quia neque ea. Vitae magni aspernatur dolores dicta.,1/31/2019 6:36,1/31/2019 6:36
5,Quis dignissimos placeat officia.,Quod dolorem soluta voluptas quia dolores repellendus. Blanditiis nobis sapiente minima dignissimos et quo sit. Id vel eos cumque eaque.,1/31/2019 6:36,1/31/2019 6:36
6,Porro corrupti suscipit quis.,Fugiat aspernatur unde qui nobis similique. Dicta aspernatur dolore quia assumenda. Magni laudantium consequuntur sit autem beatae vitae magnam.,1/31/2019 6:36,1/31/2019 6:36
7,Alias consectetur ut aut.,Fugiat dolorem sit voluptatem fuga laborum suscipit quaerat. Quidem aliquam vitae possimus nulla. Eos recusandae ullam aut autem.,1/31/2019 6:36,1/31/2019 6:36
8,Consequatur at iste praesentium quidem.,Commodi ipsa et minima recusandae. Aut est libero culpa dolores. Officia qui eos laboriosam quia veritatis.,1/31/2019 6:36,1/31/2019 6:36
9,Ea natus quae omnis et libero sapiente.,Odit eaque ut magnam a. Ad animi eligendi aut tenetur. Ab aut aut ratione nihil et. Et reprehenderit non ducimus dolor tempore ut. Asperiores hic sed quis.,1/31/2019 6:36,1/31/2019 6:36
10,Voluptates quasi recusandae est accusamus animi.,Blanditiis voluptatem earum laudantium repudiandae quidem officia. Excepturi omnis ad ipsum repellendus qui neque reiciendis. Ipsa distinctio qui voluptas animi expedita modi.,1/31/2019 6:36,1/31/2019 6:36
11,Perspiciatis magnam nihil porro id.,Consequatur vel dolore ut et est. Eos pariatur modi et dolore molestias laboriosam animi. Eveniet debitis necessitatibus odit. Dolorem dolores blanditiis ad qui ratione fugit voluptas.,1/31/2019 6:36,1/31/2019 6:36
12,Qui ut magnam aspernatur quos cupiditate sed qui.,Ea iure aut libero ut velit. Aut quo sunt dolor magnam et. Et consequatur quam earum. Quae vero consequatur temporibus sed quo eos ad.,1/31/2019 6:36,1/31/2019 6:36
13,Unde rerum laborum facilis voluptatum.,Sed ut quo quia. Tempore officia qui quia molestias. Officiis voluptas vitae sequi consequuntur corporis eligendi nostrum.,1/31/2019 6:36,1/31/2019 6:36
14,Nam facilis ab earum reiciendis culpa omnis.,Molestias quae nesciunt numquam perspiciatis voluptatum quos. Eveniet delectus laudantium dolorem ut.,1/31/2019 6:36,1/31/2019 6:36
15,Aspernatur sint eum est occaecati mollitia enim.,Nisi excepturi quos quis hic et id ab. Autem optio ratione voluptates. Debitis est accusantium in hic. Corrupti autem sit quidem commodi aut similique.,1/31/2019 6:36,1/31/2019 6:36
16,Aut mollitia facere ut et repudiandae sed.,Aut corporis corrupti et hic esse fugiat. Ut consequuntur dolor beatae cum itaque. Est qui aut voluptatem dicta. Ea nobis voluptas officiis eveniet quo.,1/31/2019 6:36,1/31/2019 6:36
17,Magnam et optio sit cum molestias ad.,Consequatur voluptas enim porro voluptatum tempore culpa. Voluptas laboriosam et voluptatem aut animi et in. Quos odit molestiae atque in. Fuga quaerat aut alias labore et est.,1/31/2019 6:36,1/31/2019 6:36
18,Officia voluptas quia ipsam cumque.,Soluta praesentium omnis tempora animi cumque est. Illo maxime placeat similique laudantium consequatur. In maiores labore quo ipsum aut. Voluptatum libero omnis quo. Adipisci sit qui et alias fugit.,1/31/2019 6:36,1/31/2019 6:36
19,Non amet sint expedita id.,Nulla minus saepe fugiat est cumque dolores. Autem reprehenderit optio dolores aut cum. Tempora nostrum dolorem aliquid. Amet laboriosam non nam eum ea.,1/31/2019 6:36,1/31/2019 6:36
20,Eius sint voluptas assumenda sint voluptatem.,Explicabo aut dolores porro perferendis. Iste velit veritatis sapiente deserunt quia neque. Minus consectetur perspiciatis iusto nisi.,1/31/2019 6:36,1/31/2019 6:36
21,Omnis dolorem nesciunt quia.,Reiciendis iste totam explicabo reprehenderit. Consequuntur vel sit cupiditate cumque et iure. Aperiam sequi ut excepturi qui unde.,1/31/2019 6:36,1/31/2019 6:36
22,Facilis non beatae magnam modi aut et.,Consectetur accusantium perspiciatis quasi voluptate. Veritatis sit dolorum accusamus voluptatem. Sed nisi porro quod sunt.,1/31/2019 6:36,1/31/2019 6:36
23,Et sint est neque totam.,Ut consectetur nobis sed aperiam ut voluptates quia. Maxime doloribus rerum hic ea dolore aut. Quae iure nobis quia voluptatem quia aut. Nisi rem aut et.,1/31/2019 6:36,1/31/2019 6:36
24,Quis enim aliquam eius.,Exercitationem aut sunt ullam praesentium est eveniet quia voluptatibus. Ducimus magni aperiam aut maxime. Facere sequi nulla laborum.,1/31/2019 6:36,1/31/2019 6:36
25,Quam iste deserunt commodi adipisci quis.,Aut deleniti doloribus ea dolorum. Cum consectetur aut et excepturi accusantium consectetur. Cum natus corporis iste fuga.,1/31/2019 6:36,1/31/2019 6:36
26,Et et perspiciatis voluptates voluptatem.,Sed velit dolor quibusdam autem. Repudiandae iure ipsum sed nesciunt. Totam ipsam est saepe ut.,1/31/2019 6:36,1/31/2019 6:36
27,Dolor sit temporibus eos dolor.,Vitae exercitationem iure est praesentium quibusdam. Autem sint repellat pariatur voluptatum. Officiis et facilis culpa in ab ea iste.,1/31/2019 6:36,1/31/2019 6:36
28,Similique cumque non aut quis aliquid.,Sunt facilis est non. Ut quam earum laudantium quas commodi. Molestias laborum nam omnis est nulla. Laborum enim iste a ipsa rerum libero repellendus.,1/31/2019 6:36,1/31/2019 6:36
29,Quos magni amet cumque voluptas hic.,Qui voluptatem ratione consequatur labore. Eum itaque incidunt debitis possimus unde id. Ut consectetur magni aut esse. Dicta voluptatum quia vitae sed nihil.,1/31/2019 6:36,1/31/2019 6:36
30,Amet labore veniam vero sunt quis voluptatem et.,Asperiores eum earum numquam architecto qui consequuntur ea. Ratione unde ipsum reprehenderit dicta atque est sequi molestiae.,1/31/2019 6:36,1/31/2019 6:36
